{"key":"content:en:_collections:navigations:sugerHeader.md","generatedAt":"2022-06-02T03:42:59.701Z","mtime":"2022-06-02T03:42:59.700Z","slug":"sugerHeader","title":"SugerHeader","position":"999999999999","to":"/collections/navigations/sugerHeader","draft":false,"page":false,"language":"en","links":[{"title":"Home","slug":"/","to":"/"},{"title":"Resources","items":[{"title":"Tutorials","slug":"tutorials","subtitle":"","to":"/tutorials","icon":"tutorials.svg","color":"bg-indigo"},{"title":"API docs","subtitle":"","slug":"docs","to":"/docs","icon":"examples.svg","color":"bg-indigo"},{"title":"Integrations","subtitle":"","slug":"docs","to":"/docs","icon":"docs.svg","color":"bg-indigo"}]},{"title":"Pricing","slug":"pricing","to":"/pricing"}],"empty":true,"description":"","body":{"raw":"---\nlinks:\n  - title: 'Home'\n    slug: '/'\n    to: '/'\n  - title: 'Resources'\n    items:\n      - title: 'Tutorials'\n        # subtitle: 'Learn with concrete cases'\n        slug: 'tutorials'\n        subtitle: ''\n        to: '/tutorials'\n        icon: 'tutorials.svg'\n        color: 'bg-indigo'\n\n      - title: 'API docs'\n        subtitle: ''\n        # subtitle: 'Create fast websites easily'\n        slug: 'docs'\n        to: '/docs'\n        icon: 'examples.svg'\n        color: 'bg-indigo'\n\n      - title: 'Integrations'\n        subtitle: ''\n        # subtitle: 'Create fast websites easily'\n        slug: 'docs'\n        to: '/docs'\n        icon: 'docs.svg'\n        color: 'bg-indigo'\n\n      # - title: 'Examples'\n      #   subtitle: 'Understand everything in Nuxt'\n      #   slug: 'examples'\n      #   to: '/examples'\n      #   icon: 'examples.svg'\n      #   color: 'bg-green-600'\n      \n      # - title: 'Master courses'\n      #   subtitle: 'Learn more with experts'\n      #   href: 'https://masteringnuxt.com/?utm_source=nuxt&utm_medium=link&utm_campaign=nsite'\n      #   icon: 'master-courses.svg'\n      #   color: 'bg-green-800'\n\n  # - title: 'Explore'\n  #   items:\n  #     - title: 'Deployments'\n  #       subtitle: 'How to Deploy Nuxt'\n  #       slug: 'deployments'\n  #       to: '/deployments'\n  #       icon: 'deployments.svg'\n  #       color: 'bg-indigo-light'\n  #     - title: 'Modules'\n  #       subtitle: 'Extend the power of Nuxt'\n  #       href: 'https://modules.nuxtjs.org'\n  #       icon: 'modules.svg'\n  #       color: 'bg-indigo'\n  #     - title: 'Themes'\n  #       subtitle: 'Get started with themes'\n  #       slug: 'themes'\n  #       to: '/themes'\n  #       icon: 'themes.svg'\n  #       color: 'bg-indigo-dark'\n  #     - title: 'Video Courses'\n  #       subtitle: 'Learn step by step'\n  #       slug: 'video-courses'\n  #       to: '/video-courses'\n  #       icon: 'video-courses.svg'\n  #       color: 'bg-indigo-darker'\n\n  # - title: 'Community'\n  #   items:\n  #     - title: 'Announcements'\n  #       subtitle: 'Latest news about Nuxt'\n  #       slug: 'announcements'\n  #       to: '/announcements'\n  #       icon: 'announcements.svg'\n  #       color: 'bg-mint-lighter'\n  #     - title: 'Teams'\n  #       subtitle: 'They are Nuxt'\n  #       slug: 'teams'\n  #       to: '/teams'\n  #       icon: 'teams.svg'\n  #       color: 'bg-mint-light'\n  #     - title: 'Releases'\n  #       subtitle: 'All the code we have released'\n  #       slug: 'releases'\n  #       to: '/releases'\n  #       icon: 'releases.svg'\n  #       color: 'bg-mint'\n  #     - title: 'Sponsors'\n  #       subtitle: 'They trust us'\n  #       slug: 'sponsors'\n  #       to: '/sponsors'\n  #       icon: 'sponsors.svg'\n  #       color: 'bg-mint-dark'\n\n  # - title: 'Partners'\n  #   slug: 'partners'\n  #   to: '/partners'\n  - title: 'Pricing'\n    slug: 'pricing'\n    to: '/pricing'\n---\n","ast":{"type":"root","children":[]},"toc":{"title":"","searchDepth":2,"depth":2,"links":[]}}}