{"key":"content:_collections:partners:agency:7.zen-architects.md","generatedAt":"2022-06-02T03:42:59.265Z","mtime":"2022-06-02T03:42:59.264Z","slug":"zen-architects","title":"Zen Architects","position":"999999999999","to":"/collections/partners/agency/zen-architects","draft":false,"page":false,"language":"en","description":"ZEN Architects provides Nuxt support by specialists with strengths in DevOps and OSS. Our team consists of top-notch experts in front-end technologies, with extensive experience developing with frameworks including Vue.js and Nuxt.js over years. We keep focusing on optimizing clients IT investment by providing the most efficient solution case by case.","logo":{"light":"/img/companies/square/light/zen-architects.svg","dark":"/img/companies/square/dark/zen-architects.svg"},"logoFull":"/img/companies/full/light/zen-architects.png","link":"https://zenarchitects.co.jp/?ref=nuxt","icon":"zen-architects.svg","fullDescription":"ZEN Architects provides Nuxt support by specialists with strengths in DevOps and OSS. Our team consists of top-notch experts in front-end technologies, with extensive experience developing with frameworks including Vue.js and Nuxt.js over years. We keep focusing on optimizing clients IT investment by providing the most efficient solution case by case.\n\nZEN Architects は DevOps や OSS に強みを持つスペシャリスト集団です。フロントエンド技術については、Vue.js や Nuxt.js などのフレームワークを使った開発経験が豊富で、チームには日本を代表するエキスパートも含まれています。ZEN Architects が提供する技術アドバイザリサービスでは、これまで数十社にのぼるエンタープライズ開発プロジェクトをサポートしてきました。私たちは日頃よりお客様のITへの投資を最適化することにフォーカスしており、ケースごとに最適な解決策を提供します。","services":["NuxtJS Consulting Service","Migration support from Nuxt2 to Nuxt3","Vue.js / NuxtJS related technical Q&A","Troubleshooting resolution support","NuxtJS Introduction Workshop"],"phoneNumber":null,"twitter":"zenarchitects","facebook":"zenarchitects","color":["#1b1b1b","#55bd90"],"location":"Tokyo, JP","empty":true,"body":{"raw":"---\ntitle: \"Zen Architects\"\ndescription: \"ZEN Architects provides Nuxt support by specialists with strengths in DevOps and OSS. Our team consists of top-notch experts in front-end technologies, with extensive experience developing with frameworks including Vue.js and Nuxt.js over years. We keep focusing on optimizing clients IT investment by providing the most efficient solution case by case.\"\nlogo: \n  light: \"/img/companies/square/light/zen-architects.svg\"\n  dark: \"/img/companies/square/dark/zen-architects.svg\"\nlogoFull: \"/img/companies/full/light/zen-architects.png\"\nlink: https://zenarchitects.co.jp/?ref=nuxt\nicon: zen-architects.svg\nfullDescription: \"ZEN Architects provides Nuxt support by specialists with strengths in DevOps and OSS. Our team consists of top-notch experts in front-end technologies, with extensive experience developing with frameworks including Vue.js and Nuxt.js over years. We keep focusing on optimizing clients IT investment by providing the most efficient solution case by case.\n\n\nZEN Architects は DevOps や OSS に強みを持つスペシャリスト集団です。フロントエンド技術については、Vue.js や Nuxt.js などのフレームワークを使った開発経験が豊富で、チームには日本を代表するエキスパートも含まれています。ZEN Architects が提供する技術アドバイザリサービスでは、これまで数十社にのぼるエンタープライズ開発プロジェクトをサポートしてきました。私たちは日頃よりお客様のITへの投資を最適化することにフォーカスしており、ケースごとに最適な解決策を提供します。\"\nservices:\n  - NuxtJS Consulting Service\n  - Migration support from Nuxt2 to Nuxt3\n  - Vue.js / NuxtJS related technical Q&A\n  - Troubleshooting resolution support\n  - NuxtJS Introduction Workshop\nphoneNumber:\ntwitter: 'zenarchitects'\nfacebook: 'zenarchitects'\ncolor:\n  - '#1b1b1b'\n  - '#55bd90'\nlocation: Tokyo, JP\n---\n","ast":{"type":"root","children":[]},"toc":{"title":"","searchDepth":2,"depth":2,"links":[]}}}